<?xml version="1.0" encoding="UTF-8"?>
<!DOCTYPE devices PUBLIC "-//bengt-martensson.de//devices//en"
 "../dtds/devices.dtd">
<devices>
  <device id="blind_nomemory" name="Generic blind or screen that moves up (by power_reverse_on) or down (by power_on), stops when power removed" model="generic" type="dumb">
    <attributes>
      <attribute name="memory" value="no"/>
    </attributes>
    <aliases>
      <alias name="down" command="power_on"/>
      <alias name="up" command="power_reverse_on"/>
      <alias name="power_off" command="power_reverse_on"/>
    </aliases>
    <commandset type="on_off">
      <command cmdref="cmd_power_on"/>
      <command cmdref="cmd_power_reverse_on"/>
      <command cmdref="get_status"/>
    </commandset>
  </device>
</devices>
