<?xml version="1.0" encoding="UTF-8"?>
<!DOCTYPE device PUBLIC "-//bengt-martensson.de//devices//en"
 "../dtds/devices.dtd">
<device id="philips_37pfl9603" name="Philips TV 37PFL9603" vendor="Philips" model="37PFL9603" type="tv" pingable_on="yes" pingable_standby="no">
  <jp1data>
    <setupcode value="1556"/>
  </jp1data>
  <commandset type="ir" protocol="rc5" toggle="yes" deviceno="0"
    remotename="philips_37pfl9603">
    <command cmdref="cmd_0" 				cmdno="0"/>
    <command cmdref="cmd_1" 				cmdno="1"/>
    <command cmdref="cmd_2" 				cmdno="2"/>
    <command cmdref="cmd_3" 				cmdno="3"/>
    <command cmdref="cmd_4" 				cmdno="4"/>
    <command cmdref="cmd_5" 				cmdno="5"/>
    <command cmdref="cmd_6" 				cmdno="6"/>
    <command cmdref="cmd_7" 				cmdno="7"/>
    <command cmdref="cmd_8" 				cmdno="8"/>
    <command cmdref="cmd_9" 				cmdno="9"/>
    <command cmdref="power_toggle" 	name="power"	cmdno="12"/>
    <!--command cmdref="tv_mode"			cmdno="63"/-->
    <command cmdref="channel_up" 			cmdno="32"/>
    <command cmdref="channel_down" 			cmdno="33"/>
    <command cmdref="mute_toggle" 	name="mute"	cmdno="13"/>
    <command cmdref="last_channel" 			cmdno="34"/>
    <command cmdref="volume_up" 			cmdno="16"/>
    <command cmdref="volume_down" 			cmdno="17"/>
    <command cmdref="PP" 				cmdno="14"/>
    <command cmdref="info" 				cmdno="15"/>
    <command cmdref="brightness_down" 			cmdno="19"/>
    <command cmdref="brightness_up" 			cmdno="18"/>
    <command cmdref="aspectratio"	 		cmdno="126"/>
    <command cmdref="menu" 				cmdno="82"/>
    <command cmdref="up" 				cmdno="80"/>
    <command cmdref="down" 				cmdno="81"/>
    <command cmdref="left" 				cmdno="85"/>
    <command cmdref="right" 				cmdno="86"/>
    <command cmdref="ok" 				cmdno="87"/>
    <command cmdref="red" 				cmdno="107"/>
    <command cmdref="green" 				cmdno="108"/>
    <command cmdref="yellow" 				cmdno="109"/>
    <command cmdref="blue" 				cmdno="110"/>
    <command cmdref="white" 				cmdno="111"/>
    <command cmdref="menu_off" 				cmdno="83"/>
    <command cmdref="I_II" 				cmdno="35"/>
    <command cmdref="teletext" 				cmdno="60"/>
    <command cmdref="teletext_freeze" 			cmdno="41"/>
    <command cmdref="teletext_reveal" 			cmdno="44"/>
    <command cmdref="teletext_hide" 			cmdno="45"/>
    <command cmdref="teletext_translucent" 		cmdno="46"/>
    <command cmdref="teletext_doubleheight" 		cmdno="43"/>
    <command cmdref="teletext_time" 			cmdno="42"/>
    <command cmdref="PIP" 				cmdno="88"/>
    <command cmdref="PIP_source" 			cmdno="95"/>
    <command cmdref="PIP_exchange" 			cmdno="90"/>
    <command cmdref="PIP_freeze" 			cmdno="101"/>
    <command cmdref="PIP_position" 			cmdno="89"/>
    <command cmdref="PIP_ch_down" 			cmdno="103"/>
    <command cmdref="PIP_ch_up" 			cmdno="102"/>
    <!--command cmdref="freeze_toggle"			cmdno="93"/-->
    <!--command cmdref="DNR" 				cmdno="97"/-->
    <!--command cmdref="special" 			cmdno="94"/-->

    <command cmdref="in_ext2" 				cmdno="57"/>
    <command cmdref="power_on" 				cmdno="63"/>
    <command cmdref="power_off" 			cmdno="61"/>

    <command cmdref="input"				cmdno="56"/>
  </commandset>

  <commandset type="ir" protocol="rc5" toggle="yes" deviceno="3" remotename="philips_37pfl9603">
<!--
Notes=Dummy device to support RC-5 commands on Philips TV discrete input selection for remotes w/o 2 byte code support (e.g. URC-6131).\n\nFunctions for this device\:\nav1\nav3\nhdmi1\nhdmi3\nside\nambilight discrete on\nambilight discrete off\nformat auto
-->

    <command cmdref="in_ext1"				cmdno="4"/>
    <command cmdref="in_side"				cmdno="5"/>
    <command cmdref="in_ext3"				cmdno="56"/>
    <command cmdref="in_hdmi1"				cmdno="57"/>
    <command cmdref="in_hdmi2"				cmdno="123"/>
    <command cmdref="in_hdmi3"				cmdno="6"/>
    <command cmdref="in_hdmi4"				cmdno="7"/>
    <command cmdref="tv_mode"				cmdno="72"/>
    <command cmdref="in_side"				cmdno="58"/>
    <command cmdref="ambilight_on"			cmdno="40"/>
    <command cmdref="ambilight_off"			cmdno="41"/>
    <!--command cmdref="aspectratio_automatic"		cmdno="61"/-->
  </commandset>

  <commandset remotename="philips_37pfl9603_rc6" type="ir" protocol="rc6" toggle="yes" deviceno="0">
    <command cmdref="power_toggle" 	cmdno="12"/>
    <command cmdref="input" 		cmdno="56"/>
    <command cmdref="teletext" 		cmdno="60"/>
    <command cmdref="teletext_pip" 	cmdno="93"/>
    <command cmdref="subtitle" 		cmdno="75"/>
    <command cmdref="aspectratio" 	cmdno="245"/>
    <command cmdref="red" 		cmdno="109"/>
    <command cmdref="green" 		cmdno="110"/>
    <command cmdref="yellow" 		cmdno="111"/>
    <command cmdref="blue" 		cmdno="112"/>
    <command cmdref="epg"		cmdno="204"/>
    <command cmdref="info"		cmdno="15"/>
    <command cmdref="up"		cmdno="88"/>
    <command cmdref="down"		cmdno="89"/>
    <command cmdref="left"		cmdno="90"/>
    <command cmdref="right"		cmdno="91"/>
    <command cmdref="ok"		cmdno="92"/>
    <command cmdref="cmd_return"	cmdno="10"/>
    <command cmdref="menu"		cmdno="84"/>

    <command cmdref="rewind"		cmdno="43"/>
    <command cmdref="play_pause"	cmdno="44"/>
    <command cmdref="fast_forward"	cmdno="40"/>
    <command cmdref="stop"		cmdno="49"/>
    <command cmdref="record_toggle"	cmdno="55"/>

    <command cmdref="volume_up"		cmdno="16"/>
    <command cmdref="volume_down"	cmdno="17"/>
    <command cmdref="mute_toggle"	cmdno="13"/>
    <command cmdref="cmd_0"		cmdno="0"/>
    <command cmdref="cmd_1"		cmdno="1"/>
    <command cmdref="cmd_2"		cmdno="2"/>
    <command cmdref="cmd_3"		cmdno="3"/>
    <command cmdref="cmd_4"		cmdno="4"/>
    <command cmdref="cmd_5"		cmdno="5"/>
    <command cmdref="cmd_6"		cmdno="6"/>
    <command cmdref="cmd_7"		cmdno="7"/>
    <command cmdref="cmd_8"		cmdno="8"/>
    <command cmdref="cmd_9"		cmdno="9"/>
    <command cmdref="clock_toggle"	cmdno="127"/>
    <command cmdref="PP"		cmdno="10"/>
    <command cmdref="ambilight_toggle"	cmdno="143"/>
    <command cmdref="ambilight_mode"	cmdno="144"/>
  </commandset>

  <xi:include href="ping.xi"/>
</device>
