<?xml version="1.0" encoding="UTF-8"?>
<!DOCTYPE device PUBLIC "-//bengt-martensson.de//devices//en" "../dtds/devices.dtd">
<device id="panasonic_dvd_s75" name="Panasonic DVD S75" vendor="Panasonic" model="S75" type="dvd">
  <!-- Use subdevice=32 for VCR2 -->
  <commandset type="ir" protocol="panasonic" toggle="no" deviceno="144" subdevice="0" remotename="panasonic_vcr_nvf55">
    <command cmdref="cmd_still_advance" 	cmdno="6"/>
    <command cmdref="cmd_stop" 			cmdno="0"/>
    <command cmdref="cmd_still_advance" 	cmdno="6"/>
    <command cmdref="cmd_rewind" 		cmdno="2"/>
    <command cmdref="cmd_play" 			cmdno="10"/>
    <command cmdref="cmd_fast_forward" 		cmdno="3"/>
    <command cmdref="cmd_record_on" 		cmdno="8"/>
    <command cmdref="cmd_slow_down" 		cmdno="143"/>
    <command cmdref="cmd_slow" 			cmdno="15"/>
    <command cmdref="cmd_slow_up" 		cmdno="142"/>
    <command cmdref="cmd_clock_counter" 	cmdno="86"/>
    <command cmdref="cmd_tape_remaining" 	cmdno="85"/>
    <command cmdref="cmd_reset" 		cmdno="84"/>
    <command cmdref="cmd_monitor" 		cmdno="145"/>
    <command cmdref="cmd_vcr_tv" 		cmdno="54"/>
    <command cmdref="cmd_input_select" 		cmdno="192"/>
    <command cmdref="cmd_index" 		cmdno="64"/>
    <command cmdref="cmd_time_search" 		cmdno="68"/>
    <command cmdref="cmd_tracking_down" 	cmdno="178"/>
    <command cmdref="cmd_tracking_up" 		cmdno="177"/>
    <command cmdref="cmd_repeat" 		cmdno="249"/>
    <command cmdref="cmd_memory" 		cmdno="244"/>
    <command cmdref="cmd_sleep" 		cmdno="242"/>
    <command cmdref="cmd_auto_rewind" 		cmdno="243"/>
    <command cmdref="cmd_audio" 		cmdno="51"/>
    <command cmdref="cmd_1" 			cmdno="16"/>
    <command cmdref="cmd_2" 			cmdno="17"/>
    <command cmdref="cmd_3" 			cmdno="18"/>
    <command cmdref="cmd_4" 			cmdno="19"/>
    <command cmdref="cmd_5" 			cmdno="20"/>
    <command cmdref="cmd_6" 			cmdno="21"/>
    <command cmdref="cmd_7" 			cmdno="22"/>
    <command cmdref="cmd_8" 			cmdno="23"/>
    <command cmdref="cmd_9" 			cmdno="24"/>
    <command cmdref="cmd_0" 			cmdno="25"/>
    <command cmdref="cmd_two_digit" 		cmdno="59"/>
    <command cmdref="cmd_timer" 		cmdno="180"/>
    <command cmdref="cmd_pal_secam" 		cmdno="201"/>
  </commandset>
</device>