<?xml version="1.0" encoding="UTF-8"?>
<!DOCTYPE device PUBLIC "-//bengt-martensson.de//devices//en" "../dtds/devices.dtd">
<device id="panasonic_dp_ub424" name="Panasonic DP UB424" vendor="Panasonic" model="DP-UB424" type="dvd" pingable_on="yes" pingable_standby="no">
    <commandset type="ir" protocol="panasonic" toggle="no" deviceno="176" subdevice="0" remotename="IR6">
        <command cmdref="power_toggle" cmdno="61"/>
        <command cmdref="cmd_1" cmdno="16"/>
        <command cmdref="cmd_2" cmdno="17"/>
        <command cmdref="cmd_3" cmdno="18"/>
        <command cmdref="open_close" cmdno="1"/>
        <command cmdref="cmd_4" cmdno="19"/>
        <command cmdref="cmd_5" cmdno="20"/>
        <command cmdref="cmd_6" cmdno="21"/>
        <command cmdref="status_toggle" cmdno="95"/>
        <command cmdref="cmd_7" cmdno="22"/>
        <command cmdref="cmd_8" cmdno="23"/>
        <command cmdref="cmd_9" cmdno="24"/>
        <command cmdref="cancel" cmdno="131"/>
        <command cmdref="cmd_0" cmdno="25"/>
        <command cmdref="audio" cmdno="51"/>
        <command cmdref="rewind" cmdno="4"/>
        <command cmdref="play" cmdno="10"/>
        <command cmdref="fast_forward" cmdno="5"/>
        <command cmdref="previous" cmdno="73"/>
        <command cmdref="pause" cmdno="6"/>
        <command cmdref="next" cmdno="74"/>
        <command cmdref="stop" cmdno="0"/>
        <command cmdref="top_menu" cmdno="155"/>
        <command cmdref="home" cmdno="87"/>
        <command cmdref="up" cmdno="133"/>
        <command cmdref="left" cmdno="135"/>
        <command cmdref="ok" cmdno="130"/>
        <command cmdref="right" cmdno="136"/>
        <command cmdref="option_menu" cmdno="128"/>
        <command cmdref="down" cmdno="134"/>
        <command cmdref="cmd_return" cmdno="129"/>
        <command cmdref="power_off" cmdno="63"/>
        <command cmdref="power_on" cmdno="62"/>
        <command cmdref="subtitle" cmdno="147"/>
        <command cmdref="still_advance" cmdno="12"/>
        <command cmdref="forward_1_min" cmdno="76"/>
        <command cmdref="back_10_seconds" cmdno="139"/>
        <command cmdref="lock_mode" cmdno="251"/>
        <command cmdref="service_mode" cmdno ="252"/>
    </commandset>
    <commandset type="ir" protocol="panasonic" toggle="no" deviceno="176" subdevice="1" remotename="IR6">
        <command cmdref="picture_menu" cmdno="38"/>
        <command cmdref="sound_effects_menu" cmdno="39"/>
        <command cmdref="factory_reset" cmdno="91"/>
        <command cmdref="playback_info" cmdno="37"/>
        <command cmdref="internet_menu" cmdno="89"/>
        <command cmdref="popup_menu" cmdno="80"/>
        <command cmdref="hdr_menu" cmdno="41"/>
        <command cmdref="netflix" cmdno="104"/>
        <command cmdref="red" cmdno="65"/>
        <command cmdref="green" cmdno="66"/>
        <command cmdref="yellow" cmdno="67"/>
        <command cmdref="blue" cmdno="64"/>
    </commandset>
    <xi:include href="ping.xi"/>
</device>
