<?xml version="1.0" encoding="UTF-8"?>
<!DOCTYPE device PUBLIC "-//bengt-martensson.de//devices//en" "../dtds/devices.dtd">
<!-- experimental -->
<device id="mce_rc1975502_00" name="MCE" vendor="Microsoft" model="" type="other">
  <commandset type="ir" protocol="mce" deviceno="4" subdevice="15"
    toggle="yes">
    <command cmdref="power_toggle"	 cmdno="12"/>

    <command cmdref="cmd_0"		 cmdno="0"/>
    <command cmdref="cmd_1"		 cmdno="1"/>
    <command cmdref="cmd_2"		 cmdno="2"/>
    <command cmdref="cmd_3"		 cmdno="3"/>
    <command cmdref="cmd_4"		 cmdno="4"/>
    <command cmdref="cmd_5"		 cmdno="5"/>
    <command cmdref="cmd_6"		 cmdno="6"/>
    <command cmdref="cmd_7"		 cmdno="7"/>
    <command cmdref="cmd_8"		 cmdno="8"/>
    <command cmdref="cmd_9"		 cmdno="9"/>
    <command cmdref="star"	 	cmdno="29"/>
    <command cmdref="hash"	 	cmdno="28"/>

    <command cmdref="tv_mode"		 cmdno="72"/>
    <command cmdref="picture_mode"	 cmdno="38"/>
    <command cmdref="movie_mode"	 cmdno="37"/>
    <command cmdref="music_mode"	 cmdno="36"/>

    <command cmdref="clear"		 cmdno="10"/>
    <command cmdref="teletext"  	 cmdno="90"/>
    <command cmdref="select"		 cmdno="11"/>

    <command cmdref="up"		 cmdno="30"/>
    <command cmdref="left"		 cmdno="32"/>
    <command cmdref="ok"		 cmdno="34"/>
    <command cmdref="left"		 cmdno="33"/>
    <command cmdref="down"		 cmdno="31"/>

    <command cmdref="volume_up"		 cmdno="16"/>
    <command cmdref="volume_down"	 cmdno="17"/>
    <command cmdref="mute"      	 cmdno="14"/>
    <command cmdref="channel_up"	 cmdno="18"/>
    <command cmdref="channel_down"	 cmdno="19"/>

    <command cmdref="record"    	 cmdno="23"/>
    <command cmdref="pause"     	 cmdno="24"/>
    <command cmdref="stop"		 cmdno="25"/>
    <command cmdref="rewind"		 cmdno="21"/>
    <command cmdref="play"		 cmdno="22"/>
    <command cmdref="fast_forward"	 cmdno="20"/>
    <command cmdref="previous"		 cmdno="27"/>
    <command cmdref="next"		 cmdno="26"/>
    <command cmdref="mce"		 cmdno="13"/>
    <command cmdref="cmd_return"	 cmdno="35"/>
    <command cmdref="info"		 cmdno="15"/>

    <command cmdref="red"		 cmdno="91"/>
    <command cmdref="green"		 cmdno="92"/>
    <command cmdref="yellow"		 cmdno="93"/>
    <command cmdref="blue"		 cmdno="94"/>
  </commandset>
</device>
