<?xml version="1.0" encoding="UTF-8"?>
<!DOCTYPE device PUBLIC "-//bengt-martensson.de//devices//en"
 "../dtds/devices.dtd">
<device xmlns:xi="http://www.w3.org/2001/XInclude" id="coolstream_neo" name="coolstream_neo" vendor="Coolstream" model="neo" type="sat"
    alt_type="cable" pingable_on="yes" pingable_standby="no"> 
  <!-- answers ping in non-deep standby -->
  <jp1data>
    <setupcode value="999"/>
  </jp1data>
  <xi:include href="tuxbox_webapi.xi">
    <xi:fallback/>
  </xi:include>
  <xi:include href="coolstream_ir.xi">
    <xi:fallback/>
  </xi:include>
  <xi:include href="ping.xi"/>
  <xi:include href="www.xi"/>
</device>
